{
  "$schema": "https://tadpoleos.dev/schemas/template-registry-v1.json",
  "repository": "Tadpole-OS-Industry-Templates",
  "industries": [
    "Legal Services",
    "Medical Practices",
    "Financial Services",
    "Digital Marketing",
    "E-commerce",
    "Real Estate",
    "Specialized Consultancies",
    "Logistics & Supply Chain",
    "Engineering & Architecture",
    "EdTech & Training",
    "Software Development",
    "Manufacturing",
    "Food & Beverage",
    "Chemical Sector",
    "Transportation & Logistics",
    "Pharmaceuticals",
    "Agriculture & AgTech",
    "Governance & Compliance",
    "Cybersecurity",
    "Human Resources",
    "Education",
    "Critical Infrastructure",
    "Media & Creative",
    "Field Services",
    "Wholesale & Distribution",
    "Geospatial Intelligence & OSINT",
    "Emergency Management & Disaster Response",
    "Maritime Operations & Domain Awareness",
    "Aerospace & Orbital Surveillance",
    "Economic & Commercial Spatial Intelligence"
  ],
  "company_sizes": [
    25,
    50,
    100,
    150,
    200
  ],
  "templates": [
    {
      "id": "legal-contract-review",
      "name": "Legal Matter Intake & Contract Review",
      "description": "Legal Operations: Client conflict check, first-pass contract review, and docket deadline management.",
      "industry": "Legal Services",
      "tags": [
        "law",
        "contracts",
        "auditing"
      ],
      "path": "legal/contract-review",
      "company_size": 25,
      "required_skills": [
        "grep_search",
        "read_file"
      ],
      "required_models": [
        "gemma4:31b"
      ],
      "content_sha256": "sha256:a0ee8a6ecce1b5921d0cbe466ae14285145d093f6b8aee50d631024f4c51edad"
    },
    {
      "id": "healthcare-patient-intake",
      "name": "Patient Intake & Scheduling Desk",
      "description": "Clinical Practice: Patient intake, appointment scheduling, HIPAA consent verification, and visit follow-ups.",
      "industry": "Medical Practices",
      "tags": [
        "healthcare",
        "intake",
        "medical"
      ],
      "path": "healthcare/patient-intake",
      "company_size": 25,
      "required_skills": [
        "grep_search",
        "read_file",
        "write_file"
      ],
      "required_models": [
        "gemma4:31b"
      ],
      "content_sha256": "sha256:0a5126e7f00b11c2393789e48317e2edeb1fde7cd10a48e5bf4761c878301aa0"
    },
    {
      "id": "development-code-reviewer",
      "name": "Sr. Architect Reviewer",
      "description": "Automated code review and architectural auditing from a senior perspective.",
      "industry": "Software Development",
      "tags": [
        "development",
        "devops",
        "code-review"
      ],
      "path": "development/code-reviewer",
      "company_size": 50,
      "required_skills": [
        "grep_search",
        "read_file",
        "write_file"
      ],
      "required_models": [
        "gemma4:31b"
      ],
      "content_sha256": "sha256:3de74d86c11428d3cc9ba6fda0c8e4f99ad20f9675ff9649fd2c7d38d6584c29"
    },
    {
      "id": "bookkeeping-audit",
      "name": "Bookkeeping & Cash Operations Swarm",
      "description": "Financial Operations: General ledger reconciliation, AP/AR cash flow, and client document collection.",
      "industry": "Financial Services",
      "tags": [
        "finance",
        "accounting",
        "tax",
        "audit"
      ],
      "path": "financial-services/bookkeeping-audit",
      "company_size": 50,
      "required_skills": [
        "grep_search",
        "read_file",
        "write_file"
      ],
      "required_models": [
        "gemma4:31b"
      ],
      "content_sha256": "sha256:1c80a87ad2ac5da8b53057a6a864973c7dc56decaed19450eaa29a9288ed9999"
    },
    {
      "id": "full-funnel-automation",
      "name": "Marketing Funnel Pilot",
      "description": "Automated content generation, ad spend optimization, and journey analytics.",
      "industry": "Digital Marketing",
      "tags": [
        "marketing",
        "ads",
        "content",
        "automation"
      ],
      "path": "digital-marketing/full-funnel-automation",
      "company_size": 50,
      "required_skills": [
        "grep_search",
        "read_file"
      ],
      "required_models": [
        "gemma4:31b"
      ],
      "content_sha256": "sha256:a703392fe21f5e2cbb381c825dc19055ead7ceaad7431e2fa2913bd0ef2e55a5"
    },
    {
      "id": "lead-transaction-management",
      "name": "Real Estate Transaction & Showing Desk",
      "description": "Brokerage Operations: Transaction coordination, speed-to-lead showing response, and listing packets.",
      "industry": "Real Estate",
      "tags": [
        "real-estate",
        "leads",
        "transactions",
        "automation"
      ],
      "path": "real-estate/lead-transaction",
      "company_size": 25,
      "required_skills": [
        "grep_search",
        "read_file",
        "write_file"
      ],
      "required_models": [
        "gemma4:31b"
      ],
      "content_sha256": "sha256:e5d05c9377d6e7eb2d581cdd04f88619108f391031332837c843cb97c97e664c"
    },
    {
      "id": "manufacturing-job-shop-25",
      "name": "Job Shop 25-Seat Operations Swarm",
      "description": "Shopfloor Operations: Work order scheduling, receiving traveler verification, job costing, and QA inspection.",
      "industry": "Manufacturing",
      "tags": [
        "manufacturing",
        "production",
        "inventory"
      ],
      "path": "manufacturing/job-shop-25",
      "company_size": 25,
      "required_skills": [
        "grep_search",
        "read_file",
        "write_file"
      ],
      "required_models": [
        "gemma4:31b"
      ],
      "content_sha256": "sha256:964ffb063d63afa9ff84e0b3289b6a70e594c957780ac49cc1ade3c236414db6"
    },
    {
      "id": "manufacturing-medium-plant-50",
      "name": "Medium Plant (50 Seats)",
      "description": "Predictive maintenance and supply chain orchestration for medium-sized facilities.",
      "industry": "Manufacturing",
      "tags": [
        "manufacturing",
        "maintenance",
        "supply-chain"
      ],
      "path": "manufacturing/medium-plant-50",
      "company_size": 50,
      "required_skills": [
        "grep_search",
        "read_file"
      ],
      "required_models": [
        "gemma4:31b"
      ],
      "content_sha256": "sha256:f8f270006b7349ffe9a43295fa3635a53b72ea57d1abb68731a7e1ca9691eab2"
    },
    {
      "id": "manufacturing-smart-factory-100",
      "name": "Smart Factory (100 Seats)",
      "description": "Enterprise-level ERP integration and digital twin synchronization across sites.",
      "industry": "Manufacturing",
      "tags": [
        "smart-factory",
        "digital-twin",
        "erp"
      ],
      "path": "manufacturing/smart-factory-100",
      "company_size": 100,
      "required_skills": [
        "grep_search",
        "read_file"
      ],
      "required_models": [
        "gemma4:31b"
      ],
      "content_sha256": "sha256:16cb820734683aa4bc6b3b07a723c0ae1009b5c4eda6c271babb011c9cbcad4b"
    },
    {
      "id": "food-restaurant-ops",
      "name": "Restaurant Floor & Shift Operations",
      "description": "Food & Beverage: Daily shift scheduling, health safety compliance, and register sales reconciliation.",
      "industry": "Food & Beverage",
      "tags": [
        "food",
        "restaurant",
        "inventory",
        "ordering"
      ],
      "path": "food/restaurant-ops",
      "company_size": 25,
      "required_skills": [
        "grep_search",
        "read_file",
        "write_file"
      ],
      "required_models": [
        "gemma4:31b"
      ],
      "content_sha256": "sha256:efa309f99b267133c2fef22e11133bba589a1e2aacf6e4f3db26da3418a42b59"
    },
    {
      "id": "chemical-process-safety",
      "name": "Chemical Safety Auditor",
      "description": "Automate chemical inventory, Safety Data Sheet (SDS) compliance auditing, and safety checklists.",
      "industry": "Chemical Sector",
      "tags": [
        "chemical",
        "safety",
        "compliance"
      ],
      "path": "chemical/process-safety",
      "company_size": 25,
      "required_skills": [
        "grep_search",
        "read_file"
      ],
      "required_models": [
        "gemma4:31b"
      ],
      "content_sha256": "sha256:ce73d31b3f254515ef87cd42ebac0e22f03093da15fd91f85b5559e4f46e7f71"
    },
    {
      "id": "transportation-fleet-logistics",
      "name": "Fleet Dispatch & DOT Maintenance Swarm",
      "description": "Transportation: Fleet preventative maintenance, ELD hours compliance, and vendor parts purchasing.",
      "industry": "Transportation & Logistics",
      "tags": [
        "transportation",
        "fleet",
        "logistics"
      ],
      "path": "transportation/fleet-logistics",
      "company_size": 25,
      "required_skills": [
        "grep_search",
        "read_file",
        "write_file"
      ],
      "required_models": [
        "gemma4:31b"
      ],
      "content_sha256": "sha256:722505973871b61954362c21ad7b3de457c428249acd9f38aa0be90efef6d64f"
    },
    {
      "id": "pharma-clinical-trials",
      "name": "Clinical Trial Manager",
      "description": "Automate clinical trial protocol mapping, trial candidate documentation, and adverse event logging.",
      "industry": "Pharmaceuticals",
      "tags": [
        "pharma",
        "clinical",
        "compliance"
      ],
      "path": "pharma/clinical-trials",
      "company_size": 25,
      "required_skills": [
        "grep_search",
        "read_file",
        "write_file"
      ],
      "required_models": [
        "gemma4:31b"
      ],
      "content_sha256": "sha256:43bcd91c1f7c979dc729fc69998f1f32d35788357623100824c9e82b79e5e8ee"
    },
    {
      "id": "agriculture-precision-farming",
      "name": "Precision Agriculture Swarm",
      "description": "Crop yield forecasting, soil health telemetry analysis, and irrigation optimization.",